username,key,value

datakirk,1,What is Generative AI and why does it matter for women?  
datakirk,2,How can Vector Search enhance AI applications?  
datakirk,3,Tell me more about building AI solutions tailored for women.  
datakirk,4,Write an email encouraging women to explore AI careers.  
datakirk,5,What advantages does a diverse dataset offer for Generative AI?  
datakirk,6,What strategies exist for making AI more inclusive and ethical?  
datakirk,7,How can AI be used to empower women in different industries?  
